{
  "schemaVersion": 1,
  "id": "basic-6d-h17-das-ls",
  "name": "Basic strategy - 6 decks, H17, DAS, late surrender",
  "rules": {
    "decks": 6,
    "dealerHitsSoft17": true,
    "dealerPeek": true,
    "dealerHoleCard": true,
    "blackjackPayout": "3:2",
    "doubleRule": "anyTwo",
    "doubleAfterSplit": true,
    "surrender": "late",
    "maxSplitHands": 4,
    "resplitAces": false,
    "hitSplitAces": false,
    "oneCardSplitAces": true,
    "insurance": true,
    "splitTensByValue": false,
    "customRules": {}
  },
  "trueCountRounding": "truncate",
  "chart": {
    "hard": {
      "h4": {
        "2": "hit",
        "3": "hit",
        "4": "hit",
        "5": "hit",
        "6": "hit",
        "7": "hit",
        "8": "hit",
        "9": "hit",
        "10": "hit",
        "A": "hit"
      },
      "h5": {
        "2": "hit",
        "3": "hit",
        "4": "hit",
        "5": "hit",
        "6": "hit",
        "7": "hit",
        "8": "hit",
        "9": "hit",
        "10": "hit",
        "A": "hit"
      },
      "h6": {
        "2": "hit",
        "3": "hit",
        "4": "hit",
        "5": "hit",
        "6": "hit",
        "7": "hit",
        "8": "hit",
        "9": "hit",
        "10": "hit",
        "A": "hit"
      },
      "h7": {
        "2": "hit",
        "3": "hit",
        "4": "hit",
        "5": "hit",
        "6": "hit",
        "7": "hit",
        "8": "hit",
        "9": "hit",
        "10": "hit",
        "A": "hit"
      },
      "h8": {
        "2": "hit",
        "3": "hit",
        "4": "hit",
        "5": "hit",
        "6": "hit",
        "7": "hit",
        "8": "hit",
        "9": "hit",
        "10": "hit",
        "A": "hit"
      },
      "h9": {
        "2": "hit",
        "3": "double",
        "4": "double",
        "5": "double",
        "6": "double",
        "7": "hit",
        "8": "hit",
        "9": "hit",
        "10": "hit",
        "A": "hit"
      },
      "h10": {
        "2": "double",
        "3": "double",
        "4": "double",
        "5": "double",
        "6": "double",
        "7": "double",
        "8": "double",
        "9": "double",
        "10": "hit",
        "A": "hit"
      },
      "h11": {
        "2": "double",
        "3": "double",
        "4": "double",
        "5": "double",
        "6": "double",
        "7": "double",
        "8": "double",
        "9": "double",
        "10": "double",
        "A": "double"
      },
      "h12": {
        "2": "hit",
        "3": "hit",
        "4": "stand",
        "5": "stand",
        "6": "stand",
        "7": "hit",
        "8": "hit",
        "9": "hit",
        "10": "hit",
        "A": "hit"
      },
      "h13": {
        "2": "stand",
        "3": "stand",
        "4": "stand",
        "5": "stand",
        "6": "stand",
        "7": "hit",
        "8": "hit",
        "9": "hit",
        "10": "hit",
        "A": "hit"
      },
      "h14": {
        "2": "stand",
        "3": "stand",
        "4": "stand",
        "5": "stand",
        "6": "stand",
        "7": "hit",
        "8": "hit",
        "9": "hit",
        "10": "hit",
        "A": "hit"
      },
      "h15": {
        "2": "stand",
        "3": "stand",
        "4": "stand",
        "5": "stand",
        "6": "stand",
        "7": "hit",
        "8": "hit",
        "9": "hit",
        "10": "surrender",
        "A": "surrender"
      },
      "h16": {
        "2": "stand",
        "3": "stand",
        "4": "stand",
        "5": "stand",
        "6": "stand",
        "7": "hit",
        "8": "hit",
        "9": "surrender",
        "10": "surrender",
        "A": "surrender"
      },
      "h17": {
        "2": "stand",
        "3": "stand",
        "4": "stand",
        "5": "stand",
        "6": "stand",
        "7": "stand",
        "8": "stand",
        "9": "stand",
        "10": "stand",
        "A": "stand"
      },
      "h18": {
        "2": "stand",
        "3": "stand",
        "4": "stand",
        "5": "stand",
        "6": "stand",
        "7": "stand",
        "8": "stand",
        "9": "stand",
        "10": "stand",
        "A": "stand"
      },
      "h19": {
        "2": "stand",
        "3": "stand",
        "4": "stand",
        "5": "stand",
        "6": "stand",
        "7": "stand",
        "8": "stand",
        "9": "stand",
        "10": "stand",
        "A": "stand"
      },
      "h20": {
        "2": "stand",
        "3": "stand",
        "4": "stand",
        "5": "stand",
        "6": "stand",
        "7": "stand",
        "8": "stand",
        "9": "stand",
        "10": "stand",
        "A": "stand"
      },
      "h21": {
        "2": "stand",
        "3": "stand",
        "4": "stand",
        "5": "stand",
        "6": "stand",
        "7": "stand",
        "8": "stand",
        "9": "stand",
        "10": "stand",
        "A": "stand"
      }
    },
    "soft": {
      "s13": {
        "2": "hit",
        "3": "hit",
        "4": "double",
        "5": "double",
        "6": "double",
        "7": "hit",
        "8": "hit",
        "9": "hit",
        "10": "hit",
        "A": "hit"
      },
      "s14": {
        "2": "hit",
        "3": "hit",
        "4": "double",
        "5": "double",
        "6": "double",
        "7": "hit",
        "8": "hit",
        "9": "hit",
        "10": "hit",
        "A": "hit"
      },
      "s15": {
        "2": "hit",
        "3": "hit",
        "4": "double",
        "5": "double",
        "6": "double",
        "7": "hit",
        "8": "hit",
        "9": "hit",
        "10": "hit",
        "A": "hit"
      },
      "s16": {
        "2": "hit",
        "3": "double",
        "4": "double",
        "5": "double",
        "6": "double",
        "7": "hit",
        "8": "hit",
        "9": "hit",
        "10": "hit",
        "A": "hit"
      },
      "s17": {
        "2": "hit",
        "3": "double",
        "4": "double",
        "5": "double",
        "6": "double",
        "7": "hit",
        "8": "hit",
        "9": "hit",
        "10": "hit",
        "A": "hit"
      },
      "s18": {
        "2": "double",
        "3": "double",
        "4": "double",
        "5": "double",
        "6": "double",
        "7": "stand",
        "8": "stand",
        "9": "hit",
        "10": "hit",
        "A": "hit"
      },
      "s19": {
        "2": "stand",
        "3": "stand",
        "4": "stand",
        "5": "stand",
        "6": "double",
        "7": "stand",
        "8": "stand",
        "9": "stand",
        "10": "stand",
        "A": "stand"
      },
      "s20": {
        "2": "stand",
        "3": "stand",
        "4": "stand",
        "5": "stand",
        "6": "stand",
        "7": "stand",
        "8": "stand",
        "9": "stand",
        "10": "stand",
        "A": "stand"
      },
      "s21": {
        "2": "stand",
        "3": "stand",
        "4": "stand",
        "5": "stand",
        "6": "stand",
        "7": "stand",
        "8": "stand",
        "9": "stand",
        "10": "stand",
        "A": "stand"
      }
    },
    "pair": {
      "pA": {
        "2": "split",
        "3": "split",
        "4": "split",
        "5": "split",
        "6": "split",
        "7": "split",
        "8": "split",
        "9": "split",
        "10": "split",
        "A": "split"
      },
      "p10": {
        "2": "stand",
        "3": "stand",
        "4": "stand",
        "5": "stand",
        "6": "stand",
        "7": "stand",
        "8": "stand",
        "9": "stand",
        "10": "stand",
        "A": "stand"
      },
      "p9": {
        "2": "split",
        "3": "split",
        "4": "split",
        "5": "split",
        "6": "split",
        "7": "stand",
        "8": "split",
        "9": "split",
        "10": "stand",
        "A": "stand"
      },
      "p8": {
        "2": "split",
        "3": "split",
        "4": "split",
        "5": "split",
        "6": "split",
        "7": "split",
        "8": "split",
        "9": "split",
        "10": "split",
        "A": "split"
      },
      "p7": {
        "2": "split",
        "3": "split",
        "4": "split",
        "5": "split",
        "6": "split",
        "7": "split",
        "8": "hit",
        "9": "hit",
        "10": "hit",
        "A": "hit"
      },
      "p6": {
        "2": "split",
        "3": "split",
        "4": "split",
        "5": "split",
        "6": "split",
        "7": "hit",
        "8": "hit",
        "9": "hit",
        "10": "hit",
        "A": "hit"
      },
      "p5": {
        "2": "double",
        "3": "double",
        "4": "double",
        "5": "double",
        "6": "double",
        "7": "double",
        "8": "double",
        "9": "double",
        "10": "hit",
        "A": "hit"
      },
      "p4": {
        "2": "hit",
        "3": "hit",
        "4": "hit",
        "5": "split",
        "6": "split",
        "7": "hit",
        "8": "hit",
        "9": "hit",
        "10": "hit",
        "A": "hit"
      },
      "p3": {
        "2": "split",
        "3": "split",
        "4": "split",
        "5": "split",
        "6": "split",
        "7": "split",
        "8": "hit",
        "9": "hit",
        "10": "hit",
        "A": "hit"
      },
      "p2": {
        "2": "split",
        "3": "split",
        "4": "split",
        "5": "split",
        "6": "split",
        "7": "split",
        "8": "hit",
        "9": "hit",
        "10": "hit",
        "A": "hit"
      }
    }
  },
  "fallbacks": {
    "hard": {
      "h9": {
        "3": "hit",
        "4": "hit",
        "5": "hit",
        "6": "hit"
      },
      "h10": {
        "2": "hit",
        "3": "hit",
        "4": "hit",
        "5": "hit",
        "6": "hit",
        "7": "hit",
        "8": "hit",
        "9": "hit"
      },
      "h11": {
        "2": "hit",
        "3": "hit",
        "4": "hit",
        "5": "hit",
        "6": "hit",
        "7": "hit",
        "8": "hit",
        "9": "hit",
        "10": "hit",
        "A": "hit"
      },
      "h15": {